Sents;Class;;;;;
The stable way of business life many corporate purchasing departments enjoy has been increasingly imperiled.;0;;;;;
As dozens of companies have already learned, supply and demand patterns can be upset virtually overnight.;0;;;;;
What capabilities will a profitable international business need to sustain itself in the face of strong protectionist pressures?;0;;;;;
Almost every kind of manufacturer will have to answer these questions.;0;;;;;
Some companies have already responded to the growing pressures.;0;;;;;
Finding that purchasing outlays had increased in less than one year to 70% of the cost of goods sold, one European office-equipment manufacturer began to rely more heavily on American and Japanese suppliers, revise its materials planning system to reduce in-process inventories, and require its divisions to add people with electronics and foreign language skills to their purchasing staffs.;0;;;;;
We have established ties to a foreign country and recently acquired another company as part of their new purchasing strategies.;4;;;;;
In many companies, purchasing, perhaps more than any other business function, is wedded to routine.;0;;;;;
Ignoring or accepting countless economic and political disruptions to their supply of materials, companies continue to negotiate annually with their established networks of suppliers or sources.;4;;;;;
But many purchasing managers skills and outlooks were formed 20 years ago in an era of relative stability, and they have not changed.;0;;;;;
Now no company can allow purchasing to lag behind other departments in acknowledging and adjusting to worldwide environmental and economic changes.;0;;;;;
Such an attitude is not only obsolete but also costly.;0;;;;;
The author offers pragmatic advice on how top management can recognize the extent of its own supply weakness and treat it with a comprehensive strategy to manage supply.;0;;;;;
He leads the reader step by step from the roots of the problem to the implementation of a solution.;0;;;;;
US auto manufacturers who customarily relied on domestic materials procurement are now reevaluating their supply schemes and broadening their scope of potential suppliers.;1;;;;;
Ford not only manufactures parts of its world car in several foreign subsidiaries but also buys transmission axles from its Japanese subsidiary.;0;;;;;
Chrysler, which was sourcing engines from Volkswagen, now buys engines from Mitsubishi.;0;;;;;
"Predictions are the US car industry will source 40% of its parts and components from abroad; 15 years ago it sourced only 5% from other countries.";0;;;;;
Others that already source on a global basis must learn to cope with uncertainties and supply or price disruptions on an unprecedented scale.;3;;;;;
Instead of simply monitoring current developments, management must learn to make things happen to its own advantage.;0;;;;;
This calls for nothing less than a total change of perspective: from purchasing) to supply management.;0;;;;;
Whenever a manufacturer must procure a volume of critical items competitively under complex conditions, supply management is relevant.;0;;;;;
Attractive new options, or serious vulnerabilities, or both, may come to light as the assessment explores questions like these.;0;;;;;
Supply is highly vulnerable to production problems.;3;;;;;
Is the company making good use of opportunities for concerted action among different divisions and/or subsidiaries?;0;;;;;
Combining the supply requirements of different divisions can increase the corporation's total buying clout.;2;;;;;
One international transportation company was buying three kinds of fuel separately: bunker oil for shipping, jet fuel for airfreight, and gasoline for trucks.;0;;;;;
The company's top management promptly ordered a change in purchasing policy to build up alternative domestic sources.;3;;;;;
A company can often take action to lessen unacceptable risk.;3;;;;;
What make-or-buy policies will give the best balance between cost and flexibility to cope with supply bottlenecks?;3;;;;;
Shaping the Supply Strategy To minimize their supply vulnerabilities is key to deal with difficult sourcing challenges.;3;;;;;
The approach has given them a simple but effective framework for collecting marketing and corporate data, forecasting future supply scenarios, and identifying available purchasing options as well as for developing individual supply strategies.;0;;;;;
A low availablilty of supply sources increases the supply risk.;3;;;;;
Low availability of scarce materials contributes to a higher risk profile of a company.;3;;;;;
Following this approach, the company first classifies all its purchased materials or components in terms of profit impact and supply risk.;0;;;;;
Next it analyzes the supply market for these materials.;0;;;;;
Then it determines its overall strategic supply position.;0;;;;;
It develops materials strategies and action plans.;0;;;;;
;0;;;;;
Supply risk is assessed in terms of availability, number of suppliers, competitive demand, make-or-buy opportunities, and storage risks and substitution possibilities.;0;;;;;
Each of these four categories requires a distinctive purchasing approach, whose complexity is in proportion to the strategic implications.;0;;;;;
As companies like Akzo, the giant Dutch chemical producer, have found, this classification permits a more differentiated and hence better focused approach to the analysis of supply market data.;0;;;;;
Shifts in supply or demand patterns can alter a material's strategic category.;0;;;;;
Therefore, any purchasing portfolio classification calls for regular updating.;0;;;;;
Phase 2: Market Analysis: Next the company weights the bargaining power of its suppliers against its own strength as a customer.;0;;;;;
It systematically reviews the supply market, assessing the availability of strategic materials in terms of both quality and quantity, and the relative strength of existing vendors.;0;;;;;
The company then analyzes its own needs and supply lines to gauge its ability to get the kind of supply terms it wants.;0;;;;;
Of the contrasting criteria of supplier and company strength listed in Exhibit III, some are self-explanatory.;0;;;;;
But six call for special comment.;0;;;;;
Supplier's break-even stability: A supplier that achieves break-even at below 70% capacity utilization can ultimately deliver at lower cost than one who breaks even at 80% utilization.;0;;;;;
Annual volume purchased and expected growth in demand: Volume, the main determinant of the company's overall bargaining power, is critical because economies of scale in purchasing often yield a decisive competitive cost advantage.;0;;;;;
In the case of many automotive parts, cost reductions as large as 4% can often be achieved by doubling the volume allocated to a given supplier.;0;;;;;
Past variations in capacity utilization of main production units.;0;;;;;
A company can judge the built-in flexibility of its supply coverage from past variations in demand resulting from sales strategies and promotions, changes in the order backlog, or overall economic conditions.;0;;;;;
In turn, projected profits may decline.;0;;;;;
Potential costs in the event of nondelivery or inadequate quality: The higher such costs and the greater the risk of incurring them, the less latitude the company has for rapidly shifting supply sources or delaying negotiations or contracts.;0;;;;;
These costs influence required inventory levels and safety stocks, but they mainly affect production.;0;;;;;
Changing a source of supply might, for example, make it necessary to modify the production process.;0;;;;;
In the case of materials for highly automated production processes, the costs of such modification could be prohibitive.;0;;;;;
No list of evaluation criteria is equally applicable to every industry: a petrochemicals producer and an automobile manufacturer would each have its own modifications to those shown in the exhibit.;0;;;;;
Moreover, the relative importance of different criteria may vary with technological change or with shifts in the industry's competitive dynamics.;0;;;;;
Careful definition of the criteria of both supplier and company strength is a prerequisite to accurate market analysis.;0;;;;;
The purchasing portfolio matrix plots company buying strength against the strengths of the supply market and can be used to develop counterstrategies key suppliers' an approach sometimes called reverse marketing.;0;;;;;
The cells in the purchasing portfolio matrix correspond to three basic risk categories, each associated with a different strategic thrust.;0;;;;;
Usually, a company will find itself in different roles with respect to different items and suppliers.;0;;;;;
The end product will be a set of systematically documented strategies for critical purchasing materials that specify the timing of and criteria for future action.;0;;;;;
The usefulness of the purchasing portfolio approach in a variety of industrial situations can be seen in the diverse experiences of four large companies.;0;;;;;
Not long ago a welding materials producer with plants and sales operations all over Europe found its profits squeezed by increased competition and slackening market growth.;0;;;;;
Searching for ways to improve the picture, the company found that supplies were critical to the production of its welding wires and electrodes.;0;;;;;
Together, just five out of the 470 different items it purchased accounted for more than 60% of the company's total purchasing volume of $135 million.;0;;;;;
Taking into account demand growth, quality standards, and logistics, the company then analyzed the European market for these five items in light of its own plant-by-plant requirements.;0;;;;;
A third step determined the company's position against a wide range of individual suppliers and assessed the risk of increasing the share sourced from each one.;0;;;;;
Finally, the company developed several strategic supply scenarios, each involving a different mix of suppliers and different assumptions about price, volume, and risk.;0;;;;;
The scenarios ranged from very low risk (total dependence on well-established sources) to very high (most purchases from lesser-known, geographically dispersed suppliers).;0;;;;;
Cost-benefit analyses of each enabled management to pinpoint several opportunities for substantial improvement.;0;;;;;
On one key item alone, electrode wire, the company's potential annual savings ranged from $1.5 million to $6.3 million, or 3% to 12% of the total cost.;0;;;;;
Supply strategies the company worked out for other key items resulted in an overall saving of 10% on purchased materials, adding some 3% to 4% to the company's pretax profits.;0;;;;;
Action plans and decision and monitoring rules developed for each item enabled buyers to implement the new sourcing strategy and permitted management to monitor purchasing activities regularly, in some cases on a day-by-day or bid-by-bid basis.;0;;;;;
A large U.S.-based maker of electrical equipment categorized castings as a key strategic purchased item and systematically analyzed its own demand in terms of the annual volume and relative complexity of each type of casting.;0;;;;;
It assessed the capabilities of each potential supplier and decided, by comparing alternative supply scenarios, which was the best fit.;1;;;;;
The resulting new mix of outside suppliers reduced the company's outlays for castings by 5% to 15% and significantly improved its competitive cost position.;0;;;;;
Anxious to reduce the risks associated with current sources of feedstock supply, a multinational chemical company revamped its entire purchasing strategy and organization.;0;;;;;
Its risk profile, however, gave real cause for concern.;0;;;;;
Examining the supply market, it identified a group of obscure, small manufacturers of precision parts that had begun to use dedicated, numerically controlled equipment.;0;;;;;
Few companies today can allow purchasing to be managed in isolation from the other elements of their overall business systems.;0;;;;;
Greater integration, stronger cross-functional relations, and more top-management involvement are all necessary.;0;;;;;
Every facet of the purchasing organization, from systems support to top-management style, will ultimately need to adapt to these requirements.;0;;;;;
Concrete changes in the organization will be required to establish effective organizational relations, provide adequate systems support, and meet the new staff and skills requirements.;0;;;;;
In particular, top management must decide to what extent it should centralize or decentralize the function.;0;;;;;
The issue is not clear-cut.;0;;;;;
While centralization augments a company's purchasing clout, it is also more inflexible.;0;;;;;
To find the right balance, companies must carefully consider trade-offs between clout and flexibility.;0;;;;;
One diversified multinational corporation, for example, successfully centralized purchasing of basic materials but found that it could not do the same with technical goods because of heterogeneous production facilities, varying national standards, and differentiated service and parts demands.;0;;;;;
Another important issue is purchasing's position in the corporate structure.;0;;;;;
Should the company treat it as a function of production or of operating divisions?;0;;;;;
Should management set it up as a central independent department or division or position it as part of the materials management function or even of a supply division?;0;;;;;
The answer will depend on factors such as volume and concentration of purchased goods as well as on the corporation's structure and complexity.;0;;;;;
Different corporate philosophies lead to different solutions.;0;;;;;
One international chemical company, for example, formed a central supply group with world-wide responsibility for all raw materials, feedstocks, and energy-related activities, while a major competitor went for all-out decentralization and gave each division its own purchasing group.;0;;;;;
Though diametrically opposed, both solutions made sense in their respective contexts.;0;;;;;
The purchasing department's structure should reflect supply-product market affinities and permit staff with specialized competence to take the lead in working out strategies for specific items.;0;;;;;
The company should encourage flexibility and entrepreneurship in its managers within the constraints of the overall corporate structure.;0;;;;;
Systems Support Too often the purchasing department receives information on the company's business plans and objectives that is incomplete or improperly geared to the tasks and time horizons of strategic supply management.;0;;;;;
Purchasing executives are usually informed of major expansion and investment projects as well as month-to-month production requirements but often lack adequate operating information with a three- to six-month time horizon, which would provide early warning of short- to medium-term demand fluctuations.;0;;;;;
The purchasing department needs these data for negotiating prices, rescheduling supply quantities, and balancing raw material inventories in response to cyclical demand swings.;0;;;;;
Complex companies with numerous products, multiple plants, and substantial production for stock (as in the consumer goods or chemical industries) are more vulnerable than are companies with a single product line and or considerable job-order production, such as industrial equipment manufacturers.;0;;;;;
In either case, tailor-made systems support will be called for.;0;;;;;
Improvement of operational flexibility through a rolling demand forecast system with a three- to six- month time horizon, coupled with systematic evaluation of supply market data. ;0;;;;;
Improved efficiency, shortened through put time, and reduction in costs and manual paperwork through EDP-supported purchasing planning, information, and disposition systems. ;0;;;;;
Integration of purchasing systems with other corporate systems, such as liquidity planning, and/or with the corresponding planning and disposition systems of key suppliers.;0;;;;;
The most familiar example is the so-called Kanban system, which allows the Japanese automaker Nissan to work with practically no parts or work-in-process inventories.;0;;;;;
Recently, however, U.S. and European car manufacturers are moving in the same direction. ;0;;;;;
Improved systems support frees buyers and management from preoccupation with day-to-day problems and enables them to focus on long-term analytic work and planning.;0;;;;;
Additional benefits include price reduction or savings, inventory reduction, reduced clerical work, and better delivery and service.;0;;;;;
The company will realize these benefits only if it uses the systems effectively.;0;;;;;
It must foster consistent, cross-functional information flows and demands and induce line managers to supply the required data for the purchasing information system.;0;;;;;
One way to reduce their instinctive resistance is to show them that most of the data already exist and need only be recast in an appropriate format.;0;;;;;
Finally, management must make certain that any major new systems are user-friendly.;0;;;;;
To meet the demands of the new supply strategy, the company must also upgrade the skills and experience it requires of key purchasing people.;0;;;;;
One big international company vastly improved the status of the purchasing division by promoting a dynamic sales executive with broad international expertise to head it.;0;;;;;
To loosen its design department's grip on supplier selection decisions, another organization hired away an expert applications engineer from a specialized process-control manufacturer and put him in charge of the purchasing department.;0;;;;;
Top management should foster a constructive atmosphere and attitude among purchasing staff before undertaking any radical staff changes.;0;;;;;
Progress toward effective supply management can only be gradual, and the company will have to surmount many obstacles to implementation along the way.;0;;;;;
But the rewards are well worth the effort.;0;;;;;
"An attitude of purchasing as usual will make the company vulnerable to competitive pressure; but enhanced strategic awareness, greater flexibility, and stronger entrepreneurial thinking in the supply area can improve the supply security and lower the input costs of any industrial company.";0;;;;;
These products are characterized by sourcing from local suppliers.;1;;;;;
Noncritical items are usually sourced decentralized.;1;;;;;
Noncritical resources include standardized products with low supply risks.;1;;;;;
Noncritical item purchases are characterized by functional efficiency.;1;;;;;
Established local suppliers can easily supply buyers.;1;;;;;
Noncritical items are usually of low profit impact and low supply risk.;1;;;;;
Where noncritical items are concerned, simple market analyses, decision policies, and inventory optimization models will normally suffice.;1;;;;;
For supply items with neither major visible risks nor major benefits, a defensive posture would be over conservative and costly.;1;;;;;
Undue aggressiveness could damage supplier relations and lead to retaliation.;2;;;;;
A company should pursue a well-balanced intermediate strategy balance.;1;;;;;
Introduction of proven purchasing analysis approaches, such as commodity analysis or value analysis, to help develop action plans for nonstrategic purchased items with limited supply complexity and risk but up to 15% savings potential.;1;;;;;
Substantial savings through standardization and alternative sourcing of process-control equipment.;1;;;;;
Only after consolidating and combining these volumes at the corporate level could the company bring its true bargaining weight to bear.;2;;;;;
A manufacturer that relies solely on spot purchases may do well to mix spot purchases and supply contracts.;2;;;;;
If the company covers a large percentage of its supplies from sources it owns, it will be in a much better negotiating position to cover the remainder of its outside requirements than its less-integrated competitors.;2;;;;;
The company may find it more profitable to source outside if suppliers have chronic overcapacity.;2;;;;;
Leverage items are characterized by exploitation of full purchasing power.;2;;;;;
Purchases are often done by contract and spot purchasing mix.;2;;;;;
Often there are targeted pricing strategies and tough negotiations.;2;;;;;
Products are easily substituted are are therefore replaceable.;2;;;;;
Vendors can be selected according to need.;2;;;;;
Purchasing decisions are normally done decentralized.;2;;;;;
These items can be sourced chiefly local.;2;;;;;
Normally there are multiple suppliers.;2;;;;;
Often these items include a mix of commodities and specified materials.;2;;;;;
Items are characterized by a good cost to price mix.;2;;;;;
Buyer power is high.;2;;;;;
Usually you can find many alternative suppliers in this market.;2;;;;;
Order volume optimization, short- to medium-term demand planning.;2;;;;;
These items are usually of medium level, e.g. chief buyer.;2;;;;;
Leverage items have a high profit impact and a low supply risk.;2;;;;;
On items where the company plays a dominant market role and suppliers' strength is rated medium or low, a reasonably aggressive strategy exploit is indicated.;2;;;;;
Components are sourced aggressively.;2;;;;;
Because the supply risk is slight, the company has a better chance of achieving a positive profit contribution through favorable pricing and contract agreements.;2;;;;;
It has to take care not to exploit the advantage too aggressively that it jeopardizes long-term supplier relationships or provokes counter reactions by insisting on rock-bottom prices in times of market discontinuity.;2;;;;;
When it can bargain from a position of strength, it should press for preferential treatment.;2;;;;;
If the company is stronger than the suppliers, it can spread volume over several suppliers, exploit price advantages, increase spot purchases, and reduce inventory levels.;2;;;;;
"In this phase, then, the company should explore a range of supply scenarios in which it lays out its options for securing long-term supply and for exploiting short-term opportunities; clearly define respective risks, costs, returns, and strategic implications; and develop a preferred option with objectives, steps, responsibilities, and contingency measures laid out in detail for top management approval and implementation.";0;;;;;
They can explout power by getting price advanteges.;2;;;;;
Detailed analysis of both demand and supply confirmed that, thanks to the sheer volume of its purchases, the company enjoyed a strong position in most feedstock supply markets.;2;;;;;
Volume bundling is a common strategy.;2;;;;;
A corporate-level review revealed attractive trade-off and substitution opportunities, which the corporation soon set about exploiting, once it had changed and upgraded its purchasing organization and systems in order to do so.;2;;;;;
Optimize sourcing by bundling volumes to exploit price advantages.;2;;;;;
Effective relations to exploit the company's full buying and bargaining power, the purchasing function must reflect the overall corporate setup.;2;;;;;
Despite the potential leverage to be obtained through improved purchasing staff and skills, hasty moves in this area can backfire, especially if they disrupt close relationships with suppliers.;2;;;;;
Threats of resource depletion and raw materials scarcity, political turbulence and government intervention in supply markets, intensified competition, and accelerating technological change have ended the days of no surprises.;3;;;;;
How can a company guard against disastrous supply interruptions and cope with the changing economics and new opportunities brought on by new technologies?;3;;;;;
The greater the uncertainty of supplier relationships, technological developments, and physical availability of those items, the more important supply management becomes.;3;;;;;
Can the company avoid anticipated supply bottlenecks and interruptions.;3;;;;;
When an automotive parts maker analyzed its sintered metal components supply market, from which it had been sourcing for years, it discovered that political instability was jeopardizing its supply.;3;;;;;
Volume insurance are bought at cost premiums if necessary.;3;;;;;
 Backup plans have to created to ensure supply. ;3;;;;;
items are usually managed by higher management levels like the department heads.;3;;;;;
Bottleneck items are usually sourced focused on cost management.;3;;;;;
For scarce components usually buyers try to find short term suppliers.;3;;;;;
There is a production based scarcity.;3;;;;;
Suppliers can artificially shorten supply to create bottlenecks. ;3;;;;;
Usually suppliers offer new technological innovations.;3;;;;;
Components are often only avaible from a few suppliers. ;3;;;;;
Bottleneck items are characterized by low profit impact, but high supply risk.;3;;;;;
Decisions about bottleneck items may require specific market analysis and decision models for resolution.;3;;;;;
Vendor and value analysis, price forecasting models, and decision models may come into play on issues affecting leverage materials.;2;;;;;
Suppliers' capacity utilization is often low.;3;;;;;
 This criterion indicates the risk of supply bottlenecks.;3;;;;;
In a cyclical upswing, with suppliers' production running at low of capacity, the probability of a bottleneck in the supply of a strategic item is extremely high.;3;;;;;
Electronics manufacturers that have neither their own chip-production facilities nor adequate contractual coverage have nightmares whenever demand for microchips heats up.;3;;;;;
A European aircraft manufacturer had specified high-grade titanium alloys for certain applications but had failed to reckon with potential supply bottlenecks.;3;;;;;
After a series of production setbacks and cost increases, it has now switched back to specialty steels.;0;;;;;
