Sents;Class;;;;;
Systems contracting is generally advised as the way of doing business with suppliers of routine products.;1;;;;;
The main idea is to enhance purchasing power by standardization and bundling of purchasing requirements.;1;;;;;
The products are ordered individually and processed efficiently.;1;;;;;
Whenever it is not possible to pool the purchasing requirements, professional purchasers adopt some kind of individual ordering, for instance by means of a purchase card.;1;;;;;
This strategy is aimed at reducing the indirect purchasing costs that are associated with administrative activities, such as ordering and invoicing.;1;;;;;
There is a low dependence between buyer and supplier.;1;;;;;
The routine character of the transaction implies that the relative power position between both parties is balanced.;1;;;;;
Total interdependence is expected to be lowest.;1;;;;;
Table gives an overview of our expectations for the power balance and the level of total interdependence in each of the identified strategies.;0;;;;;
The survey adopts a repeated measures design, respondents had to evaluate a series of identical questions for each scenario.;0;;;;;
The questions refer to buyer s dependence and supplier s dependence.;0;;;;;
Below we discuss how constructs were developed for these two variables.;0;;;;;
The distinct advantage of using a repeated measures design instead of other experimental designs is that the potential bias caused by individual differences among groups of respondents is taken away.;0;;;;;
Each of the respondents has to answer all questions in each scenario.;0;;;;;
Therefore, specific characteristics of the respondents, such as IQ, education and motivation, do not differ across the four groups that reply to the questions in each scenario.;0;;;;;
In sum, by adopting a repeated measures design, variability among groups of respondents is removed from the error term, which makes the design more powerful than randomized designs.;0;;;;;
A potential drawback of the adopted research method is that respondents might not be able to fully visualize themselves in the proposed descriptions, resulting in unreliable answers.;0;;;;;
We countered this shortcoming by including an entry for recognition of the scenario, i.e.;0;;;;;
respondents were asked to assess the degree in which they recognize the described situation.;0;;;;;
In the analysis of the data, we removed the survey results for respondents with low scores on Ôrecognition  from the database.;0;;;;;
In this way we ensured the validity of our results.;0;;;;;
The survey procedure included a pilot study aimed at enhancing the reliability and the validity of the questionnaire.;0;;;;;
The pilot study entailed discussions with six purchasing professionals in four Dutch firms.;0;;;;;
Several issues were discussed during these interviews, such as the clarity of the questionnaire items, the recognizability of the scenarios, the time needed to fill in the questionnaire and issues for further improvement of the items.;0;;;;;
On account of the pilot study several improvements have been made in the description and layout of the questionnaire items, response options and scenarios.;0;;;;;
The final questionnaire has been administered to 1153 members of the Dutch Association of Purchasing Management in three rounds.;0;;;;;
We specifically targeted these purchasing professionals, because of their vast experience, expertise and insight into the development of supplier relationships.;0;;;;;
A total number of 248 responses were received, resulting in a response rate of 21.5%.;0;;;;;
Questionnaires that were completed for less than 90% were declared invalid.;0;;;;;
Hence, a total of 10 reactions were discarded due to incomplete information.;0;;;;;
In addition, all responses were removed that scored on average less than 3 for recognition on a 5-point Likert scale.;0;;;;;
In this way, another 22 responses were omitted, resulting in an effective response rate of 18.7%.;0;;;;;
The likelihood of a non-response bias was investigated using the procedure recommended.;0;;;;;
They state that it is safe to assume that late respondents are similar to non-respondents in many respects.;0;;;;;
One should always compare the results of the first category of returned questionnaires  to the results of the second category of returned questionnaires.;0;;;;;
All our tests indicated that no statistical significant differences were found between the first wave and the second wave of respondents.;0;;;;;
Therefore, we conclude that our study does not suffer from a non-response bias.;0;;;;;
Many studies discuss different aspects of organizational dependence.;0;;;;;
Jacobs introduces two concepts from economic theory to describe dependence, namely essentiality and substitutability.;0;;;;;
He points out that it is of primary importance to the concept of dependence whether A can do without B or whether other sources are available.;0;;;;;
Scholars in Resource Dependence Theory refer to essentiality as the importance of a resource, which is said to be determined by.;0;;;;;
the relative financial magnitude of the resource.;0;;;;;
The criticality of the resource.;0;;;;;
Substitutability can be subdivided in the availability of alternative sources and the level of relation specific investments.;1;;;;;
the costs involved with switching between suppliers.;0;;;;;
With these characteristics in mind we have set up constructs for buyer s dependence and supplier s dependence as follows.;0;;;;;
It is reasonable to assume that the first aspect of organizational dependence, the relative financial magnitude of transactions, particularly impacts on supplier s dependence.;0;;;;;
When a lot of money is involved the buyer has a powerful position in negotiations.;2;;;;;
Factors such as the availability of alternative suppliers and low switching costs between suppliers are much more important to the buyer than the relative amount of money that is involved.;2;;;;;
Therefore, we have excluded financial magnitude from our construct of buyer s dependence and included it in our supplier s dependence construct.;0;;;;;
There is a difference in the perspective of buyers and suppliers with regard to the second component of dependence as well.;0;;;;;
The criticality of a resource refers to the degree in which the organization is able to continue its business processes in the absence of the resource.;3;;;;;
In essence, however, the concept is two-fold in nature.;0;;;;;
On the one hand it refers to a need for technological expertise of the partner, on the other hand it points to issues of logistical indispensability.;0;;;;;
The need for technological expertise is critical for both parties, buyer and supplier.;0;;;;;
In an industrial context, companies rely more and more on technologically advanced key suppliers.;0;;;;;
From the supplier s perspective a similar argument holds.;0;;;;;
Companies increasingly need the critical expertise and specialized knowledge of their industrial customers.;0;;;;;
Logistics-based dependence, on the other hand, is less an issue to the supplier than it is to the buyer.;0;;;;;
This unilateral dependence on the part of the buyer is explained in transaction cost theory by the concept of asset specificity.;0;;;;;
The buyer is chiefly interested in receiving the goods in a way that is logistically compatible with its own production system.;0;;;;;
The supplier will deliver the goods in any logistic way that is required, as long as the buyer will pay for it.;0;;;;;
The buyer s main concern is the correct delivery of the goods, which makes the buyer dependent on the specific assets of a certain supplier.;0;;;;;
The supplier s main concern is only of a financial nature.;0;;;;;
On the basis of these considerations we have redefined the concept of resource criticality in the construct of supplier s dependence to solely include the need for the buyer s technological expertise.;0;;;;;
The construct for buyer s dependence includes the logistical indispensability of the supplier, in addition to the need for a supplier s technological expertise.;0;;;;;
With respect to the high availability of alternative sources and low switching costs the dependence positions of buyers and suppliers are symmetrical.;1;;;;;
The buyer depends as much on the supplier as the other way around.;0;;;;;
Both buying and supplying organizations invest in the relationship with their trading partner.;4;;;;;
When the supplier develops and uses dedicated equipment assigned exclusively to one customer this will result in high switching costs if the relationship deteriorates.;4;;;;;
On the other hand, buying organizations also face relation specific investments, making significant investments in suppliers.;4;;;;;
For obvious reasons the overall dependency on the other party is also included in both variables, the construct of buyer dependence and the construct of supplier dependence.;4;;;;;
Table summarizes the components of each of the three main characteristics of buyer-supplier relationships that we have identified in this section.;0;;;;;
A reliability analysis using Cronbach s alpha was performed to ensure the internal consistency of the indicators that constitute each construct.;0;;;;;
In Table we present the results of our reliability analysis.;0;;;;;
The table shows the values of Cronbach s alpha for each purchasing strategy in the Kraljic matrix.;0;;;;;
The coefficients of Cronbach s alpha are all higher than 0.60, indicating an acceptable internal consistency and reliability of the constructs.;0;;;;;
An evaluation of the nature of buyer-supplier relationships includes the assessment of net dependence, which corresponds to the relative power of each party and total interdependence, which refers to the intensity of the relationship between parties.;0;;;;;
It shows the average score for buyer s dependence and supplier s dependence in the nine scenarios.;0;;;;;
It presents the resulting findings for the relative power position of the buyer, the difference between buyer s dependence and supplier s dependence.;0;;;;;
A positive sign for the power balance shows that the supplier dominates the relationship, whereas a negative sign points to buyer dominance.;0;;;;;
Total interdependence is depicted in the last column in Table and is measured by the sum of buyer s dependence and supplier s dependence.;0;;;;;
On a scale that runs from +2 (minimal interdependence) to +10 (maximal interdependence) we consider values below 5 as low, between 5 and 7 as moderate and above 7 as high.;0;;;;;
Note that the repeated measure design of the survey was accounted for when analysing the data.;0;;;;;
Buyer-supplier relationships in the bottleneck quadrant are also dominated by the supplier.;3;;;;;
With respect to the leverage quadrant the hypotheses for both scenarios are confirmed as well.;2;;;;;
We find buyer dominance when buyers decide to exploit their buying power.;2;;;;;
The insignificant difference between supplier dependence and buyer dependence in the situation that parties try to form a partnership points to a situation of balanced power.;4;;;;;
Both strategies in the non-critical quadrant are characterized by a significant power balance.;1;;;;;
The findings confirm all hypotheses on basis on the existing literature on buyer-supplier relationships.;0;;;;;
Except for the expectation of power balance in the case that a strategic partnership is maintained.;4;;;;;
The literature characterizes this kind of buyer-supplier relationships as satisfactory relationships based on trust, commitment and open communication.;4;;;;;
In contrast, the findings suggest that such satisfactory relationships experience an asymmetric power balance.;0;;;;;
From the buyer perspective the supplier dominates the relationship.;3;;;;;
Once a buyer has entered a partnership this ensures a disproportionate raise in the dependence of the buyer on the supplying partner.;4;;;;;
He gives a possible explanation for this phenomenon.;0;;;;;
In their belief a pre-contractual situation of balanced power shifts to a post-contractual situation of supplier dominance, when the supplier refuses to offer balance in the relationship and locks the buyer in.;4;;;;;
Our results therefore empirically confirm the belief of Cox et al.;0;;;;;
Our findings can also be explained by the notion of Frazier and Antia, that unbalanced relationships may not always be troublesome.;0;;;;;
A known distribution of power between both partners could provide effective co-ordination of the exchange relationship.;0;;;;;
In this case the relative power position is used to enhance the nature of relational exchange between trading partners.;0;;;;;
The distribution of power has become legitimated over time as both parties know what to expect from each other.;0;;;;;
Gelderman and Van Weele found that purchasing professionals adhere to two kinds of purchasing strategies in each quadrant.;0;;;;;
One type of strategy pursues preservation of the current position in the quadrant, while the other type pursues a move to another position.;0;;;;;
The relative power position of buyers and suppliers is expected to influence the choice of purchasing strategy within each quadrant.;0;;;;;
Therefore, the question is whether significant differences exist in the relative power position between the strategies that are pursued within each quadrant.;0;;;;;
Table presents the difference between purchasing strategies within each quadrant.;0;;;;;
POWER refers to the relative power position for the buyer in scenario i.;0;;;;;
A negative sign shows that supplier dominance in the first scenario is lower than in the second scenario.;0;;;;;
All differences in the power situation between quadrants turn out to be significant.;0;;;;;
This indicates that each purchasing strategy is characterized by a unique power balance between buyers and suppliers.;0;;;;;
The findings in Table confirm our prior expectations.;0;;;;;
For a critical item we find the highest level of supplier dominance when the buyer accepts the locked-in relationship.;3;;;;;
The highest level of commitment and dependence is found in the situation that a strategic partnership is maintained.;4;;;;;
These results confirm hypotheses.;0;;;;;
In a bottleneck the strategy in which the dependence position is accepted and the negative consequences are reduced by keeping safety stocks is associated with the highest supplier domination.;3;;;;;
With respect to the strategies within the leverage quadrant, we find a better power position for the buyer, a lower supplier dominance, when the buying power is exploited.;2;;;;;
The development of a strategic partnership means deterioration of the power position of the buyer.;4;;;;;
Furthermore, the results indicate a better power position for the buyer when purchasing requirements are pooled, than in the case that individual orders are placed.;1;;;;;
The last column of Table shows the level of total interdependence associated with the various purchasing strategies.;0;;;;;
Several separate tests have been undertaken to determine whether total interdependence differs significantly between individual purchasing strategies within each quadrant.;0;;;;;
The results in Table confirm our expectations.;0;;;;;
Within the strategic quadrant total interdependence is highest when the strategic partnership is maintained.;4;;;;;
In the bottleneck quadrant the highest level of interdependence is associated with an acceptance of the dependence position.;3;;;;;
With respect to the strategies within the leverage quadrant, we find a lower supplier power.;2;;;;;
The findings suggest that total interdependence is highest when a strategic partnership is developed.;4;;;;;
For the non-critical quadrant the highest level of interdependence is associated with the strategy in which purchasing requirements are pooled.;1;;;;;
The difference between the two strategies is not significant.;0;;;;;
This suggests that both strategies can be associated with a similar level of interdependence.;0;;;;;
In general, we conclude that our empirical findings confirm the hitherto untested theoretical notions about total interdependence in buyer-supplier relationships.;0;;;;;
Kraljic s approach has inspired many academics to undertake further research into purchasing portfolio models.;0;;;;;
Refined models typically recommended one purchasing strategy for each portfolio quadrant.;0;;;;;
They found that professional purchasers make a clear distinction between alternative strategies within each quadrant.;0;;;;;
The conditions determining the choice for a specific purchasing strategy within a quadrant remain yet unclear, but might very well be associated with differences in power and dependence positions.;0;;;;;
In this paper, we have empirically quantified the concepts of relative power and total interdependence for each purchasing strategy, using data from a comprehensive survey among Dutch purchasing professionals.;0;;;;;
This study builds on the case studies of Gelderman and Van Weele by adding further insights into the power and interdependence structure of the various portfolio-based purchasing strategies.;0;;;;;
The results of our study prove that there is a significant difference in the power positions between the purchasing strategies within each quadrant.;0;;;;;
Figure summarizes the results, showing the relative power positions that are associated with each purchasing strategy.;0;;;;;
Note that the diagonal line indicates positions in which buyer s dependence is equal to supplier s dependence, it indicates power balance.;0;;;;;
Strategies on the left-hand side of the diagonal line are characterized by buyer dominance, while strategies on the right-hand side are characterized by supplier dominance.;0;;;;;
The length of the perpendicular line from each data point towards the diagonal line indicates the size of the power difference between buyers and suppliers.;0;;;;;
Comparing strategies aimed at moving towards other positions in the Kraljic matrix with strategies aimed at maintaining the current position leads to the following conclusions.;0;;;;;
The strategies in the strategic and the bottleneck quadrant which are aimed at moving imply a reduction of the supply risk.;3;;;;;
Their positions in indicate that these strategies are pursued in the case that buyer s dependence is relatively low.;0;;;;;
The level of supplier s dependence seems to be less critical to the choice for these strategies.;0;;;;;
Buyers usually prefer a strategy aimed at maintaining their position in the leverage quadrant of the Kraljic matrix.;2;;;;;
Our findings suggest that relatively high levels of both buyer and supplier dependence constitute conditions for engaging in a partnership and thereby follow a strategy aimed at moving to another quadrant.;0;;;;;
Finally, no significant differences were found between scenarios 8 and 9 in the non-critical quadrant.;1;;;;;
Hence, the levels of buyer s and supplier s dependence do not seem to influence the choice for changing or maintaining the position in this quadrant.;0;;;;;
Note that the differences of purchasing strategies in the power map within each Kraljic quadrant are smaller than the differences between the quadrants.;0;;;;;
For instance, the strategies in the non-critical quadrant are located closely together in the power map, while the other strategies are at a relatively large distance.;1;;;;;
Therefore, we can conclude that the levels of buyer s and supplier s dependence largely determine the position of a purchasing strategy within the Kraljic matrix.;0;;;;;
A conclusion is that positions in the bottleneck quadrant of the matrix are associated with buyer-supplier relationships, which are characterized by supplier dominance.;3;;;;;
Positions in the non-critical quadrant are perceived to be of a more power-balanced nature.;1;;;;;
A comparison between our empirical findings and the theoretical expectations generate the following conclusions.;0;;;;;
All hypotheses regarding the power balance associated with each purchasing strategy within the quadrants were confirmed.;0;;;;;
This provocative result sheds new light on the buyer s view on issues of power and dependence.;0;;;;;
It indicates that a relationship which is characterized by a high involvement of buyers and suppliers does not necessarily imply a balanced power position between the parties, but can yet be satisfactory, at least from the point of view of the buyer.;0;;;;;
All hypotheses concerning the relative power positions of the different strategies within each quadrant and the level of total interdependence were confirmed.;0;;;;;
Despite the rigor of our analysis, our study contains several limitations that might entice further research.;0;;;;;
One of the limitations concerns the sample, which was drawn from a list of members of the Dutch Association of Purchasing Management.;0;;;;;
Although our sample included a wide range of industry sectors, the generalizability of the results would benefit from the inclusion of firms in the service sector, as well as other Dutch and international companies.;0;;;;;
This might be the object of a further study.;0;;;;;
Another limitation concerns the fact that the survey was confined to the perspective of the buyer.;0;;;;;
Yet, buyer-supplier relationships are dyadic in nature.;0;;;;;
Suppliers might have different opinions on the power and interdependence structure of the various buyer-supplier relationships.;0;;;;;
Therefore, there is a need to more fully study the supplier s perspective in order to establish whether or not both parties perceive each other s power position in the relationship in the same way.;0;;;;;
In addition, further research should take a more holistic supply chain perspective on buyer-supplier relationships and acknowledge the possible influence of critical external forces, such as regulation, standards and international trade barriers.;0;;;;;
Compelling evidence indicates that strategic management of supply markets can provide competitive advantage.;0;;;;;
However, in an effort to improve performance, not all purchased materials and buyer-supplier relationships should be managed the same way.;0;;;;;
This suggests that professional purchasing requires differentiation and some sort of classification of these resources.;0;;;;;
Consequently, many portfolio models have been developed, some of which are widely adopted in practice to manage different types of materials or buyer-supplier relationships.;0;;;;;
One of the most commonly used approaches is the Kraljic matrix, which distinguishes non-critical, leverage, bottleneck and strategic purchases along two dimensions: strategic importance and supply risk.;0;;;;;
For each portfolio quadrant, this matrix offers the buying firms corresponding generic strategic recommendations and tactics.;0;;;;;
The traditional, prescriptive view of the Kraljic matrix is intuitively appealing, as it allows purchases to be classified into four quadrants.;0;;;;;
This in turn enables purchasers to implement the quadrant-specific strategic recommendations and tactical sourcing levers in order to maximize performance.;0;;;;;
Failure to achieve the right outcomes indicates either a failure of the tool or a failure of the user.;0;;;;;
In practice, strategy implementation is often not that simple.;0;;;;;
Recommendations made by management tools, such as the Kraljic matrix, may not be seen as prescriptions but as starting points for structured discussion between different actors.;0;;;;;
In-depth discussions on the positions in the Kraljic matrix are considered as the most important phase of the analysis.;0;;;;;
Therefore, over a decade ago, authors of several studies called for moving away from advocating a strict adherence to the deterministic recommendations of the Kraljic Matrix, noting that not all purchased items in the same portfolio quadrant are to be managed in one generic way.;0;;;;;
Rather, experience shows that practitioners also pick tactical sourcing levers from adjacent quadrants that will allow them to move from a current difficult to a future much easier quadrant or power scenario.;0;;;;;
It has been hypothesized that sourcing practice demands that many, if not all, tactical sourcing levers may be used in each of the four quadrants.;0;;;;;
Surprisingly, research on purchasing portfolio models contributes little to verify how tactical sourcing levers are actually applied in practice.;0;;;;;
Prior works contrasted portfolio quadrants by differences in product characteristics, purchasing skills, buyer-supplier, power structures and organizational.;0;;;;;
Still, little is known about the actual use of portfolio models in purchasing.;0;;;;;
There is evident paucity of empirical investigations on tactical sourcing levers that can be employed in each portfolio quadrant to achieve performance targets.;0;;;;;
The move from theoretical consideration to empirical reality is still missing.;0;;;;;
Consequently, the aim of this study is to investigate if tactical sourcing levers are really applied according to the generic suggestions made by purchasing portfolio models.;0;;;;;
To do so, the study is guided by the following research question: Does the application of tactical sourcing levers vary according to strategic importance and supply?;0;;;;;
To answer this question, a detailed review of extant literature about purchasing portfolio models and tactical sourcing levers was first conducted.;0;;;;;
A measurement instrument for supply risk, strategic importance and tactical sourcing levers was developed and applied to sourcing projects including a wide range of direct purchases.;0;;;;;
Each sourcing project was later classified into the non-critical, leverage, bottleneck or strategic quadrant of the Kraljic matrix.;0;;;;;
Finally, sourcing lever profiles for each portfolio quadrant were contrasted with the help of non-parametric tests.;0;;;;;
