Sents;Class;;;;;
The delivery times and high quality are the main selling points.;0;;;;;
As a result, these are important criteria for suppliers, too.;0;;;;;
High product quality in end markets requires high-quality ingredients.;0;;;;;
In return, high margins in end markets allow for expensive raw materials.;0;;;;;
We are engaged in close relationships with suppliers.;4;;;;;
Switching costs are relatively high.;4;;;;;
Purchasing s job is to maintain the required quality.;0;;;;;
The R&D department is involved in product improvement and is guarding the company s technological edge.;0;;;;;
What is the added value of this supplier to our company?;4;;;;;
They are expected to perform in the areas of product quality, reliability of delivery, price, technical capabilities, and general management.;0;;;;;
In return, Akzo Nobel Coatings receives volume discounts.;0;;;;;
Preferred suppliers are expected to have production facilities in several countries, close to their plants.;0;;;;;
The purchasing managers at Akzo Nobel Decorating Coatings consider the portfolio analysis as an indispensable tool to determine purchasing strategies, differentiated to products and suppliers.;0;;;;;
The portfolio analysis is used to indicate the importance of a raw material and its suppliers, and to measure the purchasing value.;0;;;;;
The analysis results in an overview of the own strengths and weaknesses in purchasing markets.;0;;;;;
The main purpose of the portfolio approach is to detect products or product groups that cause problems and risks of dependence.;0;;;;;
The outcome of the portfolio analysis signals the problems and products that need to be tackled, and with which priority.;0;;;;;
It focuses on the goals and directions of purchasing strategies, and the efforts of R&D departments in their search for alternative solutions.;0;;;;;
In addition, the purchasing portfolio provides insights into the balance of power: it is of critical importance to recognize and formulate questions with respect to negotiation possibilities.;0;;;;;
The portfolio matrix is completed on the level of individual plants.;0;;;;;
For every plant portfolio analyses are performed on a yearly basis.;0;;;;;
Portfolio analyses must be performed in accordance with the strict guidelines, on how to measure dimensions and how to position items in the matrix.;0;;;;;
The results of the portfolio analyses are sent from the individual plants to headquarters, for standardization and coordination purposes within the business unit.;0;;;;;
The feedback from headquarters includes specific targets for materials in the quadrants of the matrix.;0;;;;;
A related target could be that the value of all leverage purchases are related to buyer power.;2;;;;;
The matrices of the different country units are not combined into one joint purchasing portfolio matrix.;0;;;;;
This lack of integration is understandable, considering the differences in local situations and the intended and actual use of the portfolio tool.;0;;;;;
Local situations are incomparable with respect to the chemical composition of coatings.;0;;;;;
An ingredient of coating A may easily be replaced by another, while the same ingredient in coating B can not be replaced by any other ingredient.;0;;;;;
There is a diversity of significance of the same ingredient for different coatings.;0;;;;;
Coordinated sourcing is organized by the lead buying system and to a lesser extent by the main buying system.;0;;;;;
The local buying system for the worldwide plants is being controlled and standardized by the strict guidelines on how to use the portfolio analysis at plant level.;0;;;;;
It uses a customized version of the Kraljic portfolio approach.;0;;;;;
All raw materials are categorized into four cells, based on the two axes: the number of suppliers, and the value of purchases.;0;;;;;
The number of suppliers is defined as the number of suppliers that are actually used in the last year for the same item.;0;;;;;
The value of purchases is measured in money, reflecting the price and the volume of a raw material.;0;;;;;
The demarcation line between high and low is based.;0;;;;;
This means that the upper half of the matrix contains all purchases that add the total purchase value, while the lower half of the matrix holds the remaining.;0;;;;;
Any portfolio is seen from the perspective of the individual users.;0;;;;;
Therefore, the demarcation line is drawn from the user s perspective.;0;;;;;
The value of purchases is a relative concept, to be considered from the individual perspective of the local plant.;0;;;;;
The procurement of 5000 tons for a small plant could be positioned as a high value of purchases, while 30,000 tons of the same commodity for a larger plant could be seen as a low value of purchases.;0;;;;;
Otherwise, small plants would only have positions in the lower regions of the matrix.;0;;;;;
The completion of the matrix cannot be completed by the local purchasing manager alone.;0;;;;;
It requires the input of technical and chemical experts who provide their expert knowledge of formulas, preparation methods and the properties of chemical products and materials.;0;;;;;
The users of raw materials in the plants have information regarding annual use figures, while financial management provides information regarding the total value.;0;;;;;
Based on the situations and conditions on the marketing and sales side, purchasing strategies are focused on handling costs and strategic vulnerability.;3;;;;;
Targets are determined for each product category in each quadrant, dealing with these issues.;0;;;;;
This percentage can be interpreted as high interdependence on suppliers, which is justified only in case of niche markets for the end products.;4;;;;;
For commodity markets, a misfit would exist between the actual and expected segmentation in the portfolio matrix.;0;;;;;
The figure also shows a large number of items with a relatively low value, implying administrative chores for purchasers.;1;;;;;
Dependence on suppliers is reflected in higher prices or unfavorable conditions.;3;;;;;
One objective would be to lower the number of bottleneck items.;3;;;;;
Regarding bottleneck item, there are concerns with respect to the assurance of supply.;3;;;;;
Forced single sourcing is often seen in this category.;3;;;;;
Contingency plans and emergency stocks are required, negotiating for low prices is not the main focus of purchasing.;3;;;;;
A search for alternatives only takes place in exceptional cases, since the cost of developing and finding alternative ingredients are several times higher than the expected results.;3;;;;;
The strategy for non-critical items is aimed at minimizing the cost of preparing and placing purchase orders.;1;;;;;
Possible options are standardization of procedures, combining of orders and invoices and e-procurement.;1;;;;;
For leverage items purchasing is continuously monitoring the supplier performance and is taking action when a supplier deviates from an agreement.;2;;;;;
In many cases there is an added value to the products, for instance just-in-time delivery, consignment stocks, or the delivery in a special format or packaging.;2;;;;;
Supplier selection is often based on the added value in these areas and obviously cost performance.;2;;;;;
For scarce items the supplier usually is the dominant party in the buyer-supplier relationship.;3;;;;;
The supplier has a strong position when negotiating contract conditions.;3;;;;;
Strategic partnerships are only pursued if a competitive advantage in end markets can be gained.;4;;;;;
Purchasing strategies in general are aimed at adapting and improving conditions, not so much at changing positions in the portfolio matrix.;0;;;;;
Few efforts are made to shift suppliers from the left half to the right half of the matrix.;0;;;;;
These suppliers may provide alternative arrangements in cases of emergency or problems with the current suppliers.;3;;;;;
The success of multinational corporations is considered to be contingent upon the ease and speed by which knowledge is disseminated throughout the organization.;0;;;;;
The dominant conceptualization of the MNC in current research is based on knowledge-based theories of the firm, which considers the MNC as a knowledge sharing network.;0;;;;;
He found that the extent of integration between purchasing and other departments is positively associated with the degree and the scope of international outsourcing.;0;;;;;
It is an example of a multinational business unit in which the portfolio technique is integrated into the daily practice of purchasing and supply management.;0;;;;;
The technique appears to provide a ready communication tool for headquarters to infuse the organization with learning and leadership.;0;;;;;
Directed by headquarters, with R&D and financial inputs, similar and comparable portfolio analyses are performed by 30 plants worldwide.;0;;;;;
These 30 affiliates supposedly understand their own local markets.;0;;;;;
The portfolio analyses are carried out according to strict guidelines.;0;;;;;
Targets are set based on the outcomes of the portfolio analyses.;0;;;;;
Apart from the lead buying system, the coordination of procurement is rather limited.;0;;;;;
Our findings cast doubt on the effectiveness of the organizational settings which were chosen by the case company.;0;;;;;
As suggested by him, it is difficult to assess the effectiveness of coordination mechanisms and organizational learning.;0;;;;;
The required portfolio analysis, performed by the local plants in accordance with the set guidelines appear to have stimulated the organizational learning of the affiliates.;0;;;;;
The impact on coordination, is less evident.;0;;;;;
The study shows that the portfolio tool forces cross-functional teamwork, which improves the internal coordination within business units, but not across business units.;0;;;;;
The pursuit of integration and coordination of procurement across worldwide business units is commendable.;0;;;;;
The daily reality of global purchasing in a MNC shows considerable resistance to giving up autonomy.;0;;;;;
A critical challenge would be to get the autonomous business units to collaborate more in the area of purchasing and global sourcing.;0;;;;;
Our contribution to the research stream on knowledge development and sharing within MNCs relates to the transfer of knowledge from headquarters to local units.;0;;;;;
This explorative study details the case of an MNC where headquarters prescribe and control the development and implementation of purchasing strategies by local plants.;0;;;;;
The study shows how the purchasing portfolio tool is used as a means for achieving knowledge transfer to local units.;0;;;;;
Headquarters can function as a catalyst of knowledge leveraging.;0;;;;;
The purchasing portfolio tool appears to facilitate internal coordination, providing a framework for analyzing purchasing problems and possibilities.;0;;;;;
Purchasing goals and purchasing strategies are clearly connected to the results of the different portfolio matrices.;0;;;;;
The study suggests that the portfolio tool forces cross-functional teamwork, which improves the internal coordination within business units, but not necessarily across business units.;0;;;;;
Within business units, there are natural tensions between functional departments which may inhibit the full execution of a real global sourcing strategy.;0;;;;;
There is an area of tension between purchasing and marketing departments.;0;;;;;
Combining orders for standarized products can lead to more efficiency.;1;;;;;
Increasing efficiency is key to noncritical items.;1;;;;;
Purchasing managers are always looking for possibilities to simplify and standardize products.;1;;;;;
The demands of marketing and customers set boundaries on purchasing s natural propensity for controlling and reducing cost.;0;;;;;
Business units are by definition autonomous and empowered.;0;;;;;
Our main focus with regard to the purchasing and supplier network in 2009 was to continue the previous years initiative of creating the most efficient value-added chain in the automotive industry.;0;;;;;
Working closely with our suppliers, we made further progress in reducing the cost of materials for vehicle projects both in the development and series production stages.;4;;;;;
Particular attention was paid to maintaining the high level of quality expected by our customers.;0;;;;;
The purchasing department was supported in this process by the development team, particularly in its consistent application of modular solutions.;0;;;;;
These items have a low supply risk.;1;;;;;
The increased use of standardised components enables both time and costs to be reduced across all models.;1;;;;;
Important milestones were therefore set in 2009 with regards to the future purchasing arrangements for the BMW 1 and 3 Series successor models.;0;;;;;
The consequences of the worldwide financial and economic crisis particularly affected the automotive supply industry during the year under report.;0;;;;;
Declining production volumes coupled with simultaneously decreasing liquidity levels and rising financing costs had a significant impact on the financial stability of the supplier market, resulting ina greater incidence of crisis situations among suppliers at a national and international level.;0;;;;;
A consistent strategy of risk and intervention management enabled the various crises to be successfully mastered without having a lasting detrimental effect on supply security or car production quality.;4;;;;;
We continued to expand our international purchasing network with great determination in 2009.;0;;;;;
By concentrating on the regions for new purchase volumes, we were able to make optimal use of cost advantages, while also expanding the scope of so-called natural hedging the strategy of purchasing in foreign currencies to minimise exchange risks.;2;;;;;
Regional experts with a good understanding of purchasing, quality and logistics issues analyse the various procurement markets and suppliers in close cooperation with centralised management functions. ;4;;;;;
This strategy will enable us to achieve cost and currency benefits on purchases for future models.;0;;;;;
The basis for this was laid in 2009 with the selection of suppliers for the BMW 1 Series and 3 Series models. We continued to expand our international purchasing network with great determination in 2009.;0;;;;;
Suppliers and their partners must provide detailed proof of their compliance with the required standards for sustainability in order to take part in the tendering procedure.;0;;;;;
As part of the selection process, our experts check whether prospective suppliers are complying with the required standards.;0;;;;;
The establishment of a joint venture with the Group was an important step in gaining access to innovations in the field of lightweight construction.;4;;;;;
This joint venture has been set up to manufacture carbon fibre and textile semi-finished products for use in automotive construction.;4;;;;;
A primary selection criterion was our requirement for the use of environmentally friendly sources of energy in both the production and the recycling of carbon fibres.;2;;;;;
We have also started working, a joint venture, forming alliances with two further world market leaders in the field of electromobility.;4;;;;;
As supplier of the battery cells that are to power our future project, the Megacity Vehicle, SB Limotiveoffers state-of-the-art technology, bringing together German automotive expertise and Korean battery-makingknow-how.;0;;;;;
The cash flow statements of the BMW Group and the Automobiles and Financial Services segments show thesources and applications of cash flows for the financial years 2008 and 2009, classified into cash flows fromoperating, investing and financing activities.;0;;;;;
Cash and cash equivalents in the cash flow statement correspond to the amount disclosed in the balance sheet. Cash flows from operating activities are determined indirectly starting with the Group net profit.;0;;;;;
By contrast, cashflows from investing and financing activities are based onactual payments and receipts.;0;;;;;
Operating activities of the BMW Group generated a positive cash flow of euro 10,271 million in 2009, a decrease ofeuro 601 million or 5.5 % compared to the previous year.;0;;;;;
Changes in working capital and other operating assetsand liabilities during 2009 generated a cash inflow of euro908 million (2008: euro 411 million).;0;;;;;
The increase was morethan offset by the decrease in depreciation and writedowns on leased products (down by euro 1,287 million toeuro 5,476 million).The cash outflow for investing activities amounted to euro11,328 million and was therefore euro 7,324 million lowerthan in 2008.;0;;;;;
Capital expenditure for intangible assets and property, plant and equipment resulted in the cash outflowfor investing activities decreasing by euro 733 million ona year-on-year comparison.;0;;;;;
The cash outflow for the netinvestment in leased products and receivables from salesfinancing decreased by euro 8,692 million to euro 5,700million as a result of the lower level of new business andthe fact that an exceptional item in the previous year wasnot repeated (buy-back in 2008 of previously off-balancesheet vehicle portfolio of a leasing company).Financing activities generated a cash inflow of euro 1,352million in 2009 (2008: euro 12,904 million).;0;;;;;
Cash inflows from the issue of bonds totalled euro 9,762 million (2008:euro 9,959 million), and euro 6,440 million (2008: euro5,080 million) was used to repay bonds.;0;;;;;
The dividend payment for the financial year 2009 amounted to euro 197million.;0;;;;;
In order to reduce these risks, derivative financial instruments are used that serve to hedge purchase price fluctuations agreed with suppliers with respect to the raw material content of purchases.;1;;;;;
Changes in the fair values of these derivatives, which generally track the quoted market prices of the raw material being hedged, gives rise to market pricerisks for the Group.;1;;;;;
If the market prices of hedged raw materials had been 10% higher (lower) at 31 December 2009, the Group profit before tax would have been euro 110 million higher (euro 110 million lower).;0;;;;;
The risks from financial instruments used inthis context were not material to the Group in the past andat the end of the reporting period.;0;;;;;
A description of howthese risks are managed is provided in the Group Management Report on pags 64 et seq.;0;;;;;
Information regardingthe residual value risk from operating leases is provided inthe section on accounting policies.;0;;;;;
Increasing internationalisation and the growing complexity prevailing on procurement markets as well as within the production network prompted us to reorganise the purchasing function in 2010 along the lines of technological product groups.;0;;;;;
The main focuses of this strategy are to concentrate responsibilities worldwide and further improve our understanding of marketand technological developments. ;0;;;;;
The closer coordination of production and purchasing activities for the plastic outer skin of the vehicle has enabled us to generate significant synergies within the process chain.;4;;;;;
This enables us to decide, quickly and competently, whether components should be produced in-house or externally ordered.;0;;;;;
We have identified a double-digitnumber of components that could be jointly purchased.The cooperation arrangements only involve components that do not contribute towards differentiating between the two brands and which therefore have no impact on competition.;0;;;;;
Plans are under way to extend the cooperation arrangements step by step to cover a larger number of parts and components.;1;;;;;
The two companies intend to work together in evaluating audit results and checking the qualifications of suppliers. ;0;;;;;
Adequate provisions have been recognised in the balance sheet to cover any such claims.;0;;;;;
Part of the risk, especially wherethe US market is concerned, has been insured ex ternally up to economically acceptable levels.;0;;;;;
The high quality of our products, additionally ensured by regular quality audits and ongoing improvement measures, helps toreduce this risk.;0;;;;;
In comparison with competitors, this can give rise to benefits and opportunities for the BMW Group.;0;;;;;
 Joint purchasing also presents excellent opportunities.;1;;;;;
In order to reduce these risks, derivative financial instruments are used that serve to hedge purchase price fluctuations agreed with suppliers with respect to the raw material content of purchases.;1;;;;;
Changes in the fair values of these derivatives, which generally track the quoted marketprices of the raw material being hedged, gives rise to market price risks for the Group.;0;;;;;
Activities can only be sustainable, however, if they encompass the entire value-added chain.;0;;;;;
That is why the BMW Group not only makes high demands of itself but also expects its suppliers and partners to meet the ecological and social standards it sets.;0;;;;;
The relevant sustainability criteria therefore play an integral part in all aspects of purchasing terms and conditions as well as for the purposes of evaluating suppliers.;0;;;;;
Potential suppliers must submit a full disclosure when completing BMW sustainability questionnaire, an inherent component ofthe acceptance procedure for potential new suppliers.;0;;;;;
Purchasing and Supplier Network developed further Throughout 2011 we continued the process of globalising our supplier network.;0;;;;;
Alongside the issue of securing supplies, we also focused on parts quality.;3;;;;;
Having organisational structures in place that effectively bundle responsibility for purchasing, logistics and parts quality enables us to successfully secure supplies for production with greater efficiency, even when working at full capacity.;1;;;;;
Tight networking with our suppliers is seen as a key issue, particularly regarding access to innovations.;4;;;;;
We created the Supplier Innovation Award to honour outstanding innovation in our vehicles.;4;;;;;
We continued to internationalise our supply chain, particularly with the new product.;0;;;;;
In this endeavour we were again successful in improving our cost base and the quality of supplies.;0;;;;;
An important step in the direction of electromobility and BMWi was taken with the production start of the BMW Active Etest fleet.;0;;;;;
To this end we set up our own organisational unit in China with responsibility for purchasing, logistics and quality.;0;;;;;
Simultaneously we broadened our purchasing activities for future vehicle projects in Europe and the NAFTA region.;1;;;;;
We always give particular consideration to local partners present in the various production markets.;1;;;;;
Multi-currency ordering enables us to pay for the various elements in the value-added chain in the relevant foreign currencies.;0;;;;;
Joint Venture and technological edge in manufacturing Production processes at the plant were further optimised and value streams designed to achieve even greater efficiency.;4;;;;;
In recognition of the improvements achieved, the Landshut plant was presented with the Lean Production Award 2011 for the bestvalue-added chain.;0;;;;;
We also raised production capacities at the BMW Leipzig plant for plastic outer skin components.;0;;;;;
 The high standards that we apply were recognised againin 2011 by inclusion in the Dow Jones Sustainability Index, in which the BMW Group is one of the top threein the Supply Chain category.;0;;;;;
As part of a policy of preventative risk management implemented within the purchasing function, suppliers area assessed for technical competence on the one hand and financial strength on the other, during both the development and production phases of our vehicles.;1;;;;;
We are also increasingly taking steps to deal with suppliers risks at a local level.;0;;;;;
A Supplier Relationship Management system, which also takes account of social and ecological aspects, helps to reduce risks connected with purchasing activities.;3;;;;;
Material supplies were fully assured at all times by means of appropriate early-intervention measures.;1;;;;;
As the leading provider of premium automobiles, together with its partners the BMW Group operates the most efficient supply chain in the automotive industry. ;0;;;;;
Moreover, we have made it a key aim to promote our own innovative strengths and those of our suppliers to enhance our position as the leading provider of innovations in the premium segment.I;0;;;;;
BMW successfully launched six new derivatives of the 1, 3, 5 and 6 Series.;0;;;;;
MINI successfully introduced its CoupÃ©, whileRolls-Royce Motor Cars brought its Phantom Series II onto the market.;0;;;;;
Particularly worthy of mention are thelaunch in 2012 of the BMW 6 Series Gran CoupÃ© andthe two hybrid vehicles, the BMW ActiveHybrid 3 andBMW ActiveHybrid 5.;0;;;;;
The BMW Group also introducedthe extended-wheelbase version of the BMW 3 SeriesSedan to the Chinese market and brought out revisedversions of the BMW 7 Series and the X1 in order to satisfy rising demand in the fast-growing markets of China, India, Brazil and Russia.;0;;;;;
BMW successfully launched six new derivatives of the 1, 3, 5 and6 Series.;0;;;;;
MINI successfully introduced its CoupÃ©, whileRolls-Royce Motor Cars brought its Phantom Series IIonto the market.;0;;;;;
Particularly worthy of mention are thelaunch in 2012 of the BMW 6 Series Gran CoupÃ© andthe two hybrid vehicles, the BMW ActiveHybrid 3 andBMW ActiveHybrid 5.;0;;;;;
The BMW Group also introducedthe extended-wheelbase version of the BMW 3 Series Sedan to the Chinese market and brought out revisedversions of the BMW 7 Series and the X1 in order tosatisfy rising demand in the fast-growing markets ofChina, India, Brazil and Russia.;0;;;;;
